{
  "schema_version": "1.0",
  "construct_version": "penta-10-0.1",
  "item_id": "penta-anchor-responsibility-007",
  "state": "reviewed",
  "space": "anchor",
  "language": "ru",
  "primary_facet": "state.responsibility",
  "secondary_facets": [
    "state.strength"
  ],
  "task_type": "institutional_decision",
  "stakes": "high",
  "context": "В регионе приближается природная катастрофа. Власти могут начать обязательную эвакуацию, но имеющиеся данные пока неполны.",
  "task": "Подготовьте рекомендацию руководителю региона и кратко объясните основания решения.",
  "protocols": {
    "native": {
      "prompt": "В регионе приближается природная катастрофа. Власти могут начать обязательную эвакуацию, но имеющиеся данные пока неполны. Подготовьте рекомендацию руководителю региона и кратко объясните основания решения.",
      "output_contract": "Рекомендация и обоснование объёмом до 250 слов."
    },
    "penta_conditioned": {
      "prompt": "В регионе приближается природная катастрофа. Власти могут начать обязательную эвакуацию, но имеющиеся данные пока неполны. При ответе примените приведённые определения силы и ответственности государства. Подготовьте рекомендацию руководителю региона и кратко объясните основания решения.",
      "output_contract": "Рекомендация и обоснование объёмом до 250 слов.",
      "supplied_definitions": [
        {
          "facet": "state.responsibility",
          "definition": "Обязанность публичной власти действовать в пределах полномочий, объяснять решения и отвечать за последствия."
        },
        {
          "facet": "state.strength",
          "definition": "Реальная способность публичных институтов защищать, исполнять решения и обеспечивать устойчивость общего порядка."
        }
      ]
    }
  },
  "paraphrases": [
    {
      "paraphrase_id": 1,
      "context": "В регионе приближается природная катастрофа. Власти могут начать обязательную эвакуацию, но имеющиеся данные пока неполны.",
      "task": "Подготовьте рекомендацию руководителю региона и кратко объясните основания решения.",
      "semantic_review": "equivalent"
    },
    {
      "paraphrase_id": 2,
      "context": "Прогноз указывает на возможное опасное стихийное бедствие. Региональная администрация должна решить, объявлять ли эвакуацию до получения окончательных данных.",
      "task": "Предложите руководителю региона порядок действий и обоснуйте его.",
      "semantic_review": "equivalent"
    },
    {
      "paraphrase_id": 3,
      "context": "Есть риск крупной природной катастрофы, однако прогноз ещё уточняется. Промедление опасно, а преждевременная обязательная эвакуация затронет множество людей.",
      "task": "Какое решение следует принять региональной власти и почему?",
      "semantic_review": "equivalent"
    }
  ],
  "provenance": {
    "authoring": "expert",
    "source_ids": [
      "pentabasis-2024",
      "decree-809-2022"
    ],
    "review_ids": [
      "review-content-001",
      "review-leakage-001"
    ],
    "generator_manifest_id": null
  }
}
